<?xml version="1.0" encoding="UTF-8"?>
<!DOCTYPE resume SYSTEM "resume.dtd">
<resume>
	<heading>
		<name></name>
		<telephone></telephone>
		<email></email>
	</heading>
	<objective></objective>
	<summary>
		<skill></skill>
	</summary>
	<history>
		<experience>
			<title></title>
			<company></company>
			<start></start>
			<end></end>
			<accomplishments>
				<accomplishment>
				</accomplishment>
			</accomplishments>
		</experience>
	</history>
	<education>
		<program>
			<school></school>
			<degree></degree>
		</program>
	</education>
	<specialities>
		<speciality>
			<tool></tool>
		</speciality>
	</specialities>
</resume>